Названия товара,Цена товара
Nike Blazer Low Platform W,8075
Nike Air Max 95 Essential,13950
Air Jordan 1 Zoom CMFT,12825
Air Jordan Jumpan Emblem Tee,2755
Air Jordan Jumpman Chest Tee,2755
Air Jordan Break Slide,2755
Nike Air Max Terrascape 90,12825
Nike Air Max 95 Essential,14725
Nike Offline Pack,10925
Nike NRG Tee,3705
Nike Washed Bucket Hat,2375
Nike Tie-dye Sock - 2 Pack,1425
Nike Tie-dye Sock - 2 Pack,1425
Nike Everyday Essential Ankle Sock - 3 Pack,1425
Nike Everyday Essential Ankle Sock - 3 Pack,1425
Nike Air Max 95,15675
Nike Jumpman Lightwwight Jacket,10355
Nike Everyday Essential Sock - 3 Pack,1425
Nike Everyday Essential Sock - 3 Pack,1425
Nike Cotton Cushion Low Cut  Sock - 3 Pack,1425
Air Jordan 23 Engineered Bomber Jacket,23655
Air Jordan Westbrook Why Not Tee,4275
Air Jordan Westbrook Why Not Tee,4275
Air Jordan Long Sleeve PSG Logo Tee,3705
Nike ACG Zip Jacket,16055
Nike ACG Wolf Tree Pant,10925
Nike ACG Half Zip Top,6555
Nike Good Vibes Popover Hoody,7125
Nike Good Vibes Popover Hoody,7125
Air Jordan 1 Mid BP - Younger Kids,5225
Nike Retro Woven Short,3325
Nike Tie Dye Popover Hoody,7125
Nike Lebron IX Low,16055
Nike NRG Hoody,7505
Nike Authorised Tee,3705
Nike Festival Tee,2755
Nike Festival Tee,2755
Air Jordan 23 Engineered Sweat Short,7505
Air Jordan Flight Popover Hoody,7505
Air Jordan Mountainside Fleece Pants,7505
Air Jordan 1 Mid BT,3705
Air Jordan Washed Bucket Hat,2755
Nike Air Zoom Tempo NEXT%,17005
Nike ACG Air Mowabb,14725
Nike ACG Air Mowabb,14725
Nike ACG Air Mowabb,14725
Air Jordan 13 Retro,18050
Air Jordan 1 Element 'Gore-Tex',15675
Air Jordan 5 Retro,17765
Nike Air Trainer 1 SP,12825
Nike Air Max Terrascape 90,12825
Nike Air Max Terrascape 90,12825
Nike Air Max Terrascape 90,12825
Nike Air Max Terrascape Plus,15675
Nike NRG Crew Sweat,7125
Nike  AIR ZOOM TEMPO NEXT%,17005
Nike Graphic Mesh Shorts,4655
Nike Poolside Shorts,3705
Nike Fruit Basket Tee,3325
Nike Tech Small Bag,2375
Nike Sportswear Essential Sock - 3 Pack,1425
Nike Cotton Cushion Low Cut  Sock - 3 Pack,1425
Nike Cotton Cushion Low Cut  Sock - 3 Pack,1425
Air Jordan MA-1 Jacket,19475
Nike Everyday Essential Camo Sock - 3 Pack,1425
Nike Offline Pack,10925
"Nike Swim 7"" Volley Short",4275
Air Jordan Essential Woven Pant,6175
Air Jordan Washed Jumpman Popover hoody,5225
Air Jordan Break Slide,2755
Nike Retro Logo Half Zip Hoody,7505
Nike Futura Protect Cap,2375
Nike Sportswear Essential Sock - 3 Pack,1425
Nike Sportswear Essential Sock - 3 Pack,1425
Nike ACG Gilet,21755
Nike ACG Mountain Fly Low GTX SE,15675
Nike ACG Mountain Fly Low GTX SE,15675
Nike ACG Zip Hoody,13205
Nike ACG Air Mada,12350
Nike ACG Air Mada,12350
Nike ACG Air Mada,12350
Nike ACG Sweat Pant,12255
Nike ACG Trail Pant,9975
Nike ACG Trail Pant,9975
Nike ACG OG Logo Hoody,9025
Nike ACG OG Logo Hoody,9025
Nike ACG Troll Popover Hoody,9025
Nike ACG Crew Neck Sweat,8075
Nike ACG Monolithic Tee,3705
Nike ACG OG Logo Tee,3325
Nike ACG OG Logo Tee,3325
Nike ACG OG Logo Tee,3325
Air Jordan Washed Sweat Pant,5225
Nike Air Max Terrascape Plus,15675
Nike ACG Long Sleeve Ice Cave Tee,3705
Nike Retro Logo Sneaker Pant,7505
Nike Woven Work Jacket,7505
Nike Swoosh Logo Tee,2375
Nike Swim Belted 5 Volley Short,4275
Nike Swim Belted 5 Volley Short,4275
Nike Swim Belted 5 Volley Short,4275
Nike Swim Belted 5 Volley Short,4275
"Nike Swim 7"" Volley Short",4275
"Nike Swim 7"" Volley Short",4275
"Nike Swim 7"" Volley Short",3325
"Nike Swim 7"" Volley Short",3325
"Nike Swim 7"" Volley Short",3325
Nike Swim 5 Volley Short,2755
Nike Swim 5 Volley Short,2755
Nike Swim 5 Volley Short,2755
Nike Swim 5 Volley Short,2755
"Nike Swim 7"" Volley Short",2755
"Nike Swim 7"" Volley Short",2755
"Nike Swim 7"" Volley Short",2755
Nike Good Vibes Short,5225
Nike Air Max BW OG,12255
Nike ESC Woven Shirt,42750
Nike ESC Woven Shirt,42750
Nike Blazer Mid 77 W,8455
Air Jordan PSG Fleece Pant,7125
